{
  "meta": {
    "protocol_version": "1.0.0",
    "generator": "router_layer_seq_a_star",
    "coordinate_system": {
      "type": "right_handed",
      "up_axis": "Z",
      "unit": "meter"
    },
    "voxel_grid": {
      "voxel_size": 0.2,
      "origin_wc": [
        0.0,
        0.0,
        0.0
      ],
      "dimensions": [
        20,
        20,
        20
      ]
    }
  },
  "materials": [
    {
      "id": "mat_carbon_steel",
      "display_name": "碳钢",
      "visual": {
        "base_color": [
          0.4,
          0.4,
          0.45,
          1.0
        ],
        "metallic": 0.9,
        "roughness": 0.4
      }
    }
  ],
  "assets": [
    {
      "id": "tank_A",
      "type": "Tank",
      "display_name": "Placeholder tank_A",
      "voxel_origin": [
        2,
        8,
        0
      ],
      "voxel_extent": [
        4,
        4,
        6
      ],
      "wc_center": [
        0.9,
        2.1,
        0.625
      ],
      "material_id": "mat_carbon_steel",
      "geometry": {
        "shell_radius": 0.3,
        "shell_height": 0.5,
        "head_type": "ellipsoidal",
        "head_ratio": 0.25,
        "orientation": "vertical"
      },
      "ports": [
        {
          "port_id": "port_tank_A_outlet",
          "role": "outlet",
          "vc": [
            4,
            10,
            1
          ],
          "wc": [
            0.9,
            2.1,
            0.30000000000000004
          ],
          "direction": "-Z",
          "nominal_diameter": 0.1
        },
        {
          "port_id": "port_tank_A_tap_TI101",
          "role": "outlet",
          "vc": [
            5,
            13,
            1
          ],
          "wc": [
            1.1,
            2.7,
            0.30000000000000004
          ],
          "direction": "-Z",
          "nominal_diameter": 0.1
        },
        {
          "port_id": "port_tank_A_tap_PI102",
          "role": "outlet",
          "vc": [
            5,
            6,
            1
          ],
          "wc": [
            1.1,
            1.3,
            0.30000000000000004
          ],
          "direction": "-Z",
          "nominal_diameter": 0.1
        }
      ]
    },
    {
      "id": "tank_B",
      "type": "Tank",
      "display_name": "Placeholder tank_B",
      "voxel_origin": [
        14,
        8,
        0
      ],
      "voxel_extent": [
        4,
        4,
        6
      ],
      "wc_center": [
        3.3,
        2.1,
        0.625
      ],
      "material_id": "mat_carbon_steel",
      "geometry": {
        "shell_radius": 0.3,
        "shell_height": 0.5,
        "head_type": "ellipsoidal",
        "head_ratio": 0.25,
        "orientation": "vertical"
      },
      "ports": [
        {
          "port_id": "port_tank_B_inlet",
          "role": "inlet",
          "vc": [
            16,
            10,
            1
          ],
          "wc": [
            3.3000000000000003,
            2.1,
            0.30000000000000004
          ],
          "direction": "-Z",
          "nominal_diameter": 0.1
        }
      ]
    },
    {
      "id": "inst_TI101",
      "type": "Instrument",
      "display_name": "TI-101",
      "instrument_kind": "thermometer",
      "wc_center": [
        0.3,
        2.7,
        0.3
      ],
      "material_id": "mat_carbon_steel",
      "geometry": {
        "face_axis": "+X"
      },
      "ports": [
        {
          "port_id": "inst_TI101",
          "role": "signal",
          "vc": [
            1,
            13,
            1
          ],
          "wc": [
            0.3,
            2.7,
            0.3
          ],
          "direction": "+X",
          "nominal_diameter": 0.006
        }
      ]
    },
    {
      "id": "inst_PI102",
      "type": "Instrument",
      "display_name": "PI-102",
      "instrument_kind": "pressure_gauge",
      "wc_center": [
        0.3,
        1.3,
        0.3
      ],
      "material_id": "mat_carbon_steel",
      "geometry": {
        "face_axis": "+X"
      },
      "ports": [
        {
          "port_id": "inst_PI102",
          "role": "signal",
          "vc": [
            1,
            6,
            1
          ],
          "wc": [
            0.3,
            1.3,
            0.3
          ],
          "direction": "+X",
          "nominal_diameter": 0.006
        }
      ]
    }
  ],
  "tee_joints": [],
  "segments": [
    {
      "id": "seg_L_process_A_to_B",
      "display_name": "PROC-A-B-DN100",
      "from_port": "port_tank_A_outlet",
      "to_port": "port_tank_B_inlet",
      "spec": {
        "nominal_diameter": 0.1,
        "material_id": "mat_carbon_steel",
        "with_flanges": true
      },
      "components": [
        {
          "comp_id": "seg_L_process_A_to_B_c00",
          "type": "Pipe",
          "vc_start": [
            4,
            10,
            1
          ],
          "vc_end": [
            4,
            10,
            0
          ],
          "wc_start": [
            0.9,
            2.1,
            0.30000000000000004
          ],
          "wc_end": [
            0.9,
            2.1,
            0.27444999999999997
          ],
          "axis": "-Z",
          "length_m": 0.02555
        },
        {
          "comp_id": "seg_L_process_A_to_B_c01",
          "type": "Elbow",
          "vc_center": [
            4,
            10,
            0
          ],
          "wc_center": [
            0.9,
            2.1,
            0.1
          ],
          "axis_in": "-Z",
          "axis_out": "+X",
          "angle_deg": 90,
          "bend_radius_m": 0.17145
        },
        {
          "comp_id": "seg_L_process_A_to_B_c02",
          "type": "Pipe",
          "vc_start": [
            4,
            10,
            0
          ],
          "vc_end": [
            16,
            10,
            0
          ],
          "wc_start": [
            1.0744500000000001,
            2.1,
            0.1
          ],
          "wc_end": [
            3.1255500000000005,
            2.1,
            0.1
          ],
          "axis": "+X",
          "length_m": 2.0511
        },
        {
          "comp_id": "seg_L_process_A_to_B_c03",
          "type": "Elbow",
          "vc_center": [
            16,
            10,
            0
          ],
          "wc_center": [
            3.3000000000000003,
            2.1,
            0.1
          ],
          "axis_in": "+X",
          "axis_out": "+Z",
          "angle_deg": 90,
          "bend_radius_m": 0.17145
        },
        {
          "comp_id": "seg_L_process_A_to_B_c04",
          "type": "Pipe",
          "vc_start": [
            16,
            10,
            0
          ],
          "vc_end": [
            16,
            10,
            1
          ],
          "wc_start": [
            3.3000000000000003,
            2.1,
            0.27444999999999997
          ],
          "wc_end": [
            3.3000000000000003,
            2.1,
            0.30000000000000004
          ],
          "axis": "+Z",
          "length_m": 0.02555
        }
      ]
    },
    {
      "id": "seg_L_sig_TI101",
      "display_name": "SIG-TI101",
      "from_port": "inst_TI101",
      "to_port": "port_tank_A_tap_TI101",
      "spec": {
        "nominal_diameter": 0.006,
        "material_id": "mat_carbon_steel",
        "with_flanges": false
      },
      "components": [
        {
          "comp_id": "seg_L_sig_TI101_c00",
          "type": "SignalLine",
          "vc_start": [
            1,
            13,
            1
          ],
          "vc_end": [
            5,
            13,
            1
          ],
          "wc_start": [
            0.30000000000000004,
            2.7,
            0.30000000000000004
          ],
          "wc_end": [
            1.1,
            2.7,
            0.30000000000000004
          ],
          "axis": "+X",
          "length_m": 0.8
        }
      ]
    },
    {
      "id": "seg_L_sig_PI102",
      "display_name": "SIG-PI102",
      "from_port": "inst_PI102",
      "to_port": "port_tank_A_tap_PI102",
      "spec": {
        "nominal_diameter": 0.006,
        "material_id": "mat_carbon_steel",
        "with_flanges": false
      },
      "components": [
        {
          "comp_id": "seg_L_sig_PI102_c00",
          "type": "SignalLine",
          "vc_start": [
            1,
            6,
            1
          ],
          "vc_end": [
            5,
            6,
            1
          ],
          "wc_start": [
            0.30000000000000004,
            1.3,
            0.30000000000000004
          ],
          "wc_end": [
            1.1,
            1.3,
            0.30000000000000004
          ],
          "axis": "+X",
          "length_m": 0.8
        }
      ]
    }
  ]
}